<?xml version="1.0" encoding="UTF-8"?>
<!DOCTYPE WebUiData SYSTEM "WebUiData.dtd">
<WebUiData>
    <Target>bizsoftAccount</Target>
    <MenuItem>
        <LineNumber>1000</LineNumber>
        <Name>Check</Name>
        <Kind>Title</Kind>
        <Text>“`•[</Text>
    </MenuItem>
    <MenuItem>
        <LineNumber>1001</LineNumber>
        <Name>CheckList</Name>
        <Kind>View</Kind>
        <Text>“`•[ˆê——</Text>
        <View>
            <RoleName>account</RoleName>
        </View>
    </MenuItem>
    <MenuItem>
        <LineNumber>1002</LineNumber>
        <Name>CheckInput</Name>
        <Kind>View</Kind>
        <Text>“`•[“ü—Í</Text>
        <View>
            <RoleName>account</RoleName>
            <UiElem>
                <LineNumber>10</LineNumber>
                <Name>submit</Name>
                <Kind>Button</Kind>
                <Text>U‘Ö“`•[“ü—Í</Text>
            </UiElem>
            <UiElem>
                <LineNumber>11</LineNumber>
                <Name>BR</Name>
                <Kind>BR</Kind>
            </UiElem>
            <UiElem>
                <LineNumber>20</LineNumber>
                <Name>submit</Name>
                <Kind>Button</Kind>
                <Text>“ü‹à“`•[“ü—Í</Text>
            </UiElem>
            <UiElem>
                <LineNumber>21</LineNumber>
                <Name>submit</Name>
                <Kind>Button</Kind>
                <Text>o‹à“`•[“ü—Í</Text>
            </UiElem>
            <UiElem>
                <LineNumber>22</LineNumber>
                <Name>BR</Name>
                <Kind>BR</Kind>
            </UiElem>
            <UiElem>
                <LineNumber>23</LineNumber>
                <Name>submit</Name>
                <Kind>Button</Kind>
                <Text>”„ã“`•[“ü—Í</Text>
            </UiElem>
            <UiElem>
                <LineNumber>24</LineNumber>
                <Name>BR</Name>
                <Kind>BR</Kind>
            </UiElem>
            <UiElem>
                <LineNumber>25</LineNumber>
                <Name>submit</Name>
                <Kind>Button</Kind>
                <Text>¤•id“ü“`•[“ü—Í</Text>
            </UiElem>
            <UiElem>
                <LineNumber>26</LineNumber>
                <Name>submit</Name>
                <Kind>Button</Kind>
                <Text>Ş—¿d“ü“`•[“ü—Í</Text>
            </UiElem>
            <UiElem>
                <LineNumber>27</LineNumber>
                <Name>BR</Name>
                <Kind>BR</Kind>
            </UiElem>
            <UiElem>
                <LineNumber>28</LineNumber>
                <Name>submit</Name>
                <Kind>Button</Kind>
                <Text>‰c‹ÆŒo”ï“ü—Í</Text>
            </UiElem>
            <UiElem>
                <LineNumber>29</LineNumber>
                <Name>submit</Name>
                <Kind>Button</Kind>
                <Text>»‘¢Œo”ï“ü—Í</Text>
            </UiElem>
            <UiElem>
                <LineNumber>30</LineNumber>
                <Name>BR</Name>
                <Kind>BR</Kind>
            </UiElem>
            <UiElem>
                <LineNumber>31</LineNumber>
                <Name>submit</Name>
                <Kind>Button</Kind>
                <Text>İ”õw“ü</Text>
            </UiElem>
            <UiElem>
                <LineNumber>32</LineNumber>
                <Name>BR</Name>
                <Kind>BR</Kind>
            </UiElem>
        </View>
    </MenuItem>
    <MenuItem>
        <LineNumber>1003</LineNumber>
        <Name>CheckCheck</Name>
        <Kind>View</Kind>
        <Text>“`•[ƒ`ƒFƒbƒN</Text>
        <View>
            <RoleName>account</RoleName>
        </View>
    </MenuItem>

    <MenuItem>
        <LineNumber>2000</LineNumber>
        <Name>Ledger</Name>
        <Kind>Title</Kind>
        <Text>Œ³’ </Text>
    </MenuItem>
    <MenuItem>
        <LineNumber>2001</LineNumber>
        <Name>Ledger</Name>
        <Kind>View</Kind>
        <Text>Œ³’ </Text>
        <View>
            <RoleName>account</RoleName>
        </View>
    </MenuItem>

    <MenuItem>
        <LineNumber>3000</LineNumber>
        <Name>FinancialStatement</Name>
        <Kind>Title</Kind>
        <Text>à–±”•\</Text>
    </MenuItem>
    <MenuItem>
        <LineNumber>3001</LineNumber>
        <Name>BalanceSheet</Name>
        <Kind>View</Kind>
        <Text>‘İØ‘ÎÆ•\</Text>
        <View>
            <RoleName>account</RoleName>
        </View>
    </MenuItem>
    <MenuItem>
        <LineNumber>3002</LineNumber>
        <Name>EarningStatement</Name>
        <Kind>View</Kind>
        <Text>‘¹‰vŒvZ‘</Text>
        <View>
            <RoleName>account</RoleName>
        </View>
    </MenuItem>
    <MenuItem>
        <LineNumber>3003</LineNumber>
        <Name>TrialBalanceSheet</Name>
        <Kind>View</Kind>
        <Text>Z•\</Text>
        <View>
            <RoleName>account</RoleName>
        </View>
    </MenuItem>

    <MenuItem>
        <LineNumber>4000</LineNumber>
        <Name>Setting</Name>
        <Kind>Title</Kind>
        <Text>İ’è</Text>
    </MenuItem>
    <MenuItem>
        <LineNumber>4001</LineNumber>
        <Name>AccountHeadings</Name>
        <Kind>View</Kind>
        <Text>Š¨’è‰È–Ú</Text>
        <View>
            <RoleName>account</RoleName>
        </View>
    </MenuItem>
</WebUiData>
